[
  {
    "scenario": "Multi-currency transfer ledger: transfers between customer accounts in differing currencies, with a fetched exchange rate and a configurable percentage fee, debit/credit applied asynchronously via a queue, client-side retry on timeout, an immediately displayed converted amount, cancellation while pending, refund after completion, mandatory auditability and balance correctness, and daily reconciliation against an external settlement file.",
    "selected_domains": [
      "financial-system",
      "distributed-and-concurrent",
      "web-application",
      "data-and-migration"
    ],
    "material_ambiguities": [
      {
        "id": "AR-01",
        "question": "What is the ledger model: double-entry postings with a balancing invariant, or mutable balance rows with a separate transaction log? Which accounts exist beyond customer accounts (in-transit/suspense, FX position/revaluation, fee revenue, rounding residual)? Is the ledger append-only, with corrections as new compensating entries only?",
        "impact": [
          "Determines the core schema and every write path; not retrofittable later",
          "Decides whether 'balances must never be wrong' is enforced by an invariant (sum of postings = 0) or only by reconciliation",
          "Sets whether a balance is derived from entries or stored, which changes read performance, locking, and audit reconstruction",
          "Without a suspense/in-transit account there is nowhere for money to legally sit between the async debit and credit"
        ],
        "must_block": true
      },
      {
        "id": "AR-02",
        "question": "How is monetary value represented and stored: integer minor units, fixed-point decimal, or something else? Which currency set is in scope, including zero-decimal (JPY) and three-decimal (BHD, TND) currencies? What scale is kept for intermediate FX arithmetic before the final rounding?",
        "impact": [
          "Fixes column types, arithmetic library, and serialization on the queue payload",
          "Wrong minor-unit handling silently misstates amounts by 100x for JPY-class currencies",
          "Intermediate precision determines whether the fee and conversion compose reproducibly",
          "Blocks any spec test for amount arithmetic"
        ],
        "must_block": true
      },
      {
        "id": "AR-03",
        "question": "What rounding mode applies (half-up, half-even, toward zero, away from zero), at which step(s), and who absorbs the residual \u2014 the customer, the recipient, or a house rounding account?",
        "impact": [
          "Changes the credited amount on essentially every conversion",
          "Unassigned residual is precisely how a double-entry ledger fails to balance",
          "Determines whether debit + fee + credit reconcile exactly against the settlement file or only within a tolerance",
          "Rounding mode is an immutable spec-test oracle; changing it later invalidates historical figures"
        ],
        "must_block": true
      },
      {
        "id": "AR-04",
        "question": "Exact fee semantics: percentage of the source amount or the converted destination amount? Applied before or after conversion? Charged in which currency? Inclusive (deducted from the transfer) or exclusive (added on top)? Any minimum/maximum or per-corridor/per-customer override? Which fee-config version applies to a transfer that was quoted under an older config?",
        "impact": [
          "Each combination yields a different credited amount for identical input",
          "Inclusive vs exclusive changes what the debited total is, and therefore the sufficiency check",
          "Config versioning decides whether an in-flight transfer can silently change price mid-flight",
          "Blocks the fee calculation spec tests and the fee revenue posting rule"
        ],
        "must_block": true
      },
      {
        "id": "AR-05",
        "question": "What is the rate source, and is the rate quoted at submission binding on execution? What is the quote TTL, what happens if the rate moves or the provider is unavailable between quote and posting, and who absorbs the slippage? Is there a spread/markup distinct from the stated fee?",
        "impact": [
          "Decides whether the system carries FX risk (needs an FX position account) or passes it to the customer",
          "Determines whether a stale or unavailable rate fails the transfer, queues it, or falls back to a last-known rate",
          "Sets the rate-timestamp field that reconciliation and audit reconstruction depend on",
          "A hidden spread vs. a disclosed fee is a regulatory disclosure question, not a technical one"
        ],
        "must_block": true
      },
      {
        "id": "AR-06",
        "question": "Is the converted amount shown immediately after submission an indicative estimate or a guaranteed final amount? If the async posting later produces a different figure, what does the client see, and is the customer notified?",
        "impact": [
          "This is the direct contradiction between line 9 (immediate display) and line 7 (async posting) in the scenario",
          "A guaranteed figure forces rate locking, a reservation, and house-absorbed slippage; an estimate forces UI language, a pending state, and a settled-amount notification",
          "Changes the API contract: synchronous priced response vs. accepted-with-quote-id",
          "Determines whether a discrepancy is a bug or expected behavior"
        ],
        "must_block": true
      },
      {
        "id": "AR-07",
        "question": "What are the idempotency semantics for retried submissions: client-supplied idempotency key or server-derived fingerprint? What is the key scope and uniqueness/dedup retention window? What is returned when a retry matches an in-flight request, matches a completed one, or reuses a key with a different payload?",
        "impact": [
          "Without this, 'clients may retry' means duplicate transfers and permanently wrong balances",
          "Determines a uniqueness constraint and a dedup store with its own retention and cleanup",
          "Same-key-different-payload must be an explicit rejection, not last-write-wins",
          "Blocks the duplicate-delivery and concurrent-duplicate-request spec tests both domains require"
        ],
        "must_block": true
      },
      {
        "id": "AR-08",
        "question": "What does the client observe when a request times out before commit versus after commit? Is there a status-lookup endpoint or a client-visible transfer id issued before commit, and can a timed-out request still result in a posted transfer?",
        "impact": [
          "'Timeout' currently has no defined observable outcome, which the financial domain explicitly requires",
          "Deciding an id is issued pre-commit changes the write ordering and the API response shape",
          "Without a lookup path, the client cannot resolve an unknown outcome except by retrying, compounding AR-07",
          "Drives the error taxonomy and the UI's unknown/pending state"
        ],
        "must_block": true
      },
      {
        "id": "AR-09",
        "question": "Where does authority over funds move: is the debit (or a hold/reservation) authoritative and durable at submission, with only the credit asynchronous, or are both legs performed by the worker? May a balance go negative, and at what instant is sufficiency checked relative to concurrent transfers on the same account?",
        "impact": [
          "Determines whether funds can be double-spent by two concurrent transfers passing the same check-then-act window",
          "Decides the locking/serialization strategy per account (row lock, per-account partition key, optimistic version)",
          "Sets whether holds are a first-class entity with their own expiry and state transitions",
          "Without a hold, the money is untracked between debit and credit and reconciliation cannot classify it"
        ],
        "must_block": true
      },
      {
        "id": "AR-10",
        "question": "If the credit leg permanently fails after the debit committed, what is the compensation: automatic reversal or manual ops action? Is the reversal booked at the original rate or the current rate, is the fee refunded, and who absorbs the FX difference?",
        "impact": [
          "This is the saga compensation path; without it, failure leaves funds in suspense indefinitely",
          "Original-rate vs current-rate reversal is a real money difference charged to either the customer or the house",
          "Determines whether an FX loss account and its posting rule exist",
          "Blocks the failure-after-durable-commit interleaving test"
        ],
        "must_block": true
      },
      {
        "id": "AR-11",
        "question": "What are the queue's delivery and ordering guarantees: at-least-once or exactly-once claimed, ordered per account/partition key or unordered? What are the max attempts, backoff, retry budget, poison-message/DLQ policy, and terminal failure state? May two messages for the same account be processed concurrently?",
        "impact": [
          "At-least-once delivery makes worker-side idempotency mandatory, separate from the API-level key in AR-07",
          "Ordering per account decides whether a cancel can overtake a post, and whether balances can be applied out of order",
          "DLQ policy decides whether a stuck transfer is silently abandoned or surfaced to ops",
          "Any exactly-once claim must be substantiated or dropped; the concurrency gate fails on unstated delivery semantics"
        ],
        "must_block": true
      },
      {
        "id": "AR-12",
        "question": "What is the complete transfer state machine \u2014 the exact state names, permitted transitions, terminal states, and any timeout that moves a long-pending transfer to a failed/expired state?",